1,阿胶 糯米 红糖 
1,艾叶 粳米 红糖 
1,艾叶 生姜 鸡蛋 
1,生地 丹参 益母草 乌贼骨 茜草 旱莲草 炒蕲艾 
1,白茅根 龙骨 牡蛎 三七 白芨 大黄 藕节炭 
1,活鲤鱼 苎麻根 糯米 葱 姜 油 盐 
1,夏枯草 槐花 连翘 甘草 红花 金银花 
1,乳香 没药 三七 象皮 龙骨 儿茶 石膏 
1,大黄 郁金 降香 三七 当归 牛膝 
1,芍药 当归 黑附子lt;炮裂 去皮 黄芩 白术 甘草 阿胶 地黄 
1,蚕豆花 
1,晚蚕蛾 白芷 当归 陈石灰 
1,生地 龟版 石膏 龙齿 石斛 花粉 丹皮 羚羊角 沙参 白芍 
1,苍术 地榆 
1,苍术 陈皮 黄柏 黄连 连翘 黄芩 
1,石榴皮 
1,臭椿白皮 苍术 枳壳 
1,真胆矾不拘多少 
1,侧柏叶 人参 荆芥 
1,人参 白术 三七 五味子 
1,地黄苗 地菘 青蒿 苍耳苗 芍药 艾叶 
1,石灰 刺蓟 马齿 韭 百草霜 
1,地黄汁200毫升 生姜汁100毫升 黄牛乳200毫升 藕汁200毫升 胡桃仁 干柿 枣仁 清酒200毫升 黄明胶 秦艽末 杏仁 
1,百合 熟地 玄参 骨皮 贝母 兜铃 当归 紫菀 白芍 沙参 寸冬 桔梗 甘草 
1,白蔹 白及 白芷 碧芦皮 
1,鲜白荷花瓣 
1,白芷 地黄 当归 白蔹 芎藭 川椒 黑附子 甘草 
1,白术 人参 茯苓 黄耆 山药 百合 甘草 前胡 柴胡 
1,白及粉 糯米 枣仁 蜂蜜 
1,白及 白蔹 乌鱼骨 紫参 黄芩 龙骨 
1,侧柏叶 
1,柏叶 干姜 艾叶 党参 白术 炙草 阿胶 三七 
1,地黄 小蓟 人参 蒲黄 当归 芎藭 乌梅 
1,蒲黄 螺儿清 
1,荷叶 石斛 大小蓟 香墨 甘草 白芍 丹皮 藕节 黄芩 百合 栀子 陈皮 棕榈炭 贝母 生地1.25干克 竹茹 
1,铁树叶 鲜荷叶 侧柏叶 大蓟 生地炭 荷叶炭 棕榈炭 橘络 石斛 甘草 陈皮 丹皮 生地 贝母 黄芩 百合 木通 香墨 
1,墨面 红花 冰片 麝香 熊胆 冰糖 阿胶 
1,石灰 地菘苗 细辛 旋覆根 新葛叶 青蒿 麦门冬苗 猪膏 
1,五倍子 白芷 石灰 堇泥 
1,槐角 当归 生地 黄芩 黄柏 侧柏叶 枳壳 地榆 荆芥 防风 黄连 川芎 生姜 乌梅 
1,乳香 没药 羌活 紫苏 细辛 乌药 麝香半字 蛇含石 厚桂 白芷 降香 当归 苏木 檀香 龙骨 天南星 丹参 寄生尾 花蕊石 
1,多年老石灰 血竭 松香 乳香 没药 
1,黄芩 
1,大人参 
1,狗脊 明矾 血竭 
1,黄耆 当归 三七 茯苓 丹皮 
1,白芍 当归 荆芥 三七 
1,生地炭 当归 黄芩 地榆 栀子 生白芍 升麻 槐花 侧柏炭 乌梅 生阿胶 芥穗 黄连 
1,地黄 当归 黄酒 
1,黄连 槐花 苍术 甘草 白术 厚朴 枳壳 陈皮 藿香 当归 
1,生地 白芷 白芍 川芎 当归 蒲黄 阿胶 小蓟根 
1,晚蚕蛾不以多少 
1,似锦 倚松子 豫吞 半两铜钱 
1,地菘苗 石灰末 旋覆苗 葛叶 青蒿苗 麦门冬苗 
1,阿胶 糯米 
1,反鼻 蒲黄 半 
1,女贞子 墨旱莲 
1,风化石灰末 干姜 生栗子末 白药末 
1,防风 秦艽 当归 川芎 生地 白芍 茯苓 连翘 槟榔 甘草 栀子 地榆 枳壳 槐角 白芷 苍术 
1,茯苓 黄芩 栀子 皮硝 赤石脂 升麻 紫菀 生麦门冬 竹叶 香豉 石膏 地黄 
1,番泻叶 
1,地松 地黄苗 青蒿 苍耳苗 芍药 石灰 生艾汁 黄丹 
1,党参 白术 茯苓 柴胡 白芍 蒲黄 血余炭 艾碳 
1,地榆 蒲黄 生槐角 大黄 
1,蓍草 七叶一枝花 高良姜 枯矾 木香 肉桂 
1,皂矾 西洋参 海马 肉桂 枣仁 核桃仁 
1,桑叶 桑白皮 地骨皮 甘草 生地 地榆 枇杷叶 紫菀 黄芩 黛蛤散 
1,桑叶 地骨皮 甘草 生地 地榆 枇杷叶 紫菀 黄芩 黛蛤散 
1,党参 熟地 杜仲 川断 干姜炭 鹿角霜 十灰散 
1,乌贼 甘松 草叩 川楝 元胡 生麦芽 贝母 生草 
1,苋菜 甘草 旱莲草 蜂蜜10毫升 
1,人参 当归 川芎 荆芥 干姜 熟地 
1,滑石 甘草 朱砂面 雄黄 冰片 
1,黄芪 巴戟天 川断 当归 白芍 熟地 侧柏叶 艾叶 
1,黄芩 白芍 龟版 黄柏 椿树根皮 香附 
1,人参 熟地 茱萸 白术 麦冬 甘草 丹皮 
1,人参 黄耆 归身 甘草 煨姜 枣仁 白芍 
1,白及 旱莲草 侧柏叶 地榆 
1,大黄 巴豆 半两钱 羊胫炭 
1,矾金 半夏 风化石灰 
1,黄连 茱萸 
1,生地 荆芥 
1,黄芩 
1,甘草 地黄 白术 黑附子 阿胶 黄芩 灶中黄土 
1,甘草 地黄 白术 黑附子 阿胶 黄芩 灶中黄土 
1,羚羊角 牡蛎 石斛 麦冬 南沙参 贝母 夏枯草4 丹皮 荆芥 薄荷 茜草 牛膝 白茅根 藕5大片 
1,新鲜荷叶 粳米 冰糖 
1,荷叶 藕节 大蓟 小蓟 知母 黄芩 地黄 棕榈 栀子 白茅根 玄参 白芍 当归 香墨 
1,荷叶 藕节 大小蓟 知母 黄芩 生地 棕榈炭 栀子 香墨 白茅根 玄参 白芍 当归 
1,花蕊石 丹参 
1,花蕊石 
1,胡粉 麝香 
1,琥珀 鳖甲 京三棱 延胡索 没药 大黄 
1,新石灰 韭菜 苎麻叶 小秦王草 
1,古窑石灰 紫矿 
1,多年陈石灰 鸡子清 
1,乳香 没药 
1,槐角 地榆 黄芩 枳壳 当归 防风 
1,槐角 地榆 当归 防风 黄芩 枳壳 
1,炒槐角 枳壳 陈皮 甘草 
1,槐花 槐角 生地 黄连 银花 黄柏 滑石 当归 升麻 柴胡 枳壳 黄芩 甘草 
1,槐花 柏叶 荆芥 枳壳 
1,苍术 厚朴 陈皮 当归 枳壳 槐花 甘草 乌梅 
1,槐花 栀子 
1,槐花 百草霜 
1,槐花 柏叶 荆芥 枳壳 
1,槐花 地榆 金银花 茵陈 茯苓 甘草 贝母 白芷 桔梗 
1,旱莲草 枣仁 
1,旱莲草 
1,生赭石 半夏 蒌仁 生杭芍 竹茹 牛蒡 甘草 
1,花蕊石 三七 血余炭 
1,丹参 赤芍 茜草 三七 降香 
1,鸡冠花 米酒 
1,石灰 韭菜叶 
1,漂冬丹 石膏 
1,石灰 地菘苗 细辛 旋覆根 葛叶 猪膏 青蒿 麦门冬苗 益母苗不拘多少 
1,老松香不拘多少 
1,龙骨 生白矾 熟白矾 生五倍子 熟五倍子 乳香 没药 无名异 
1,钓掉根 当归 芎? 地黄 续断 鹿茸 龙骨 
1,龙骨 乳香 没药 白矾 无名异 五倍子 
1,天门冬 紫菀茸 葳蕤 生地 麦冬肉 白芍 百合 款冬花 知母 山药 陈皮 贝母 茜草 
1,银末 血竭 发灰 人指甲 珍珠 
1,嫩老鼠 不拘多少 韭菜根与老鼠一般多 
1,马前子 枳壳 
1,龙眼核 
1,松香 夏果 刘寄奴 
1,白芍 当归 荆芥 黑栀 红花 柴胡 甘草 
1,当归 川芎 白芍 地黄 黄连 2.4克 2.1克 2.1克 2.4克 1.5克 1.8克 1.8克 
1,阿胶 艾叶 当归 川芎 白芍 熟地 蒲黄 黄连 黄芩 生地 栀子 地榆 白术 甘草 
1,丹砂 草乌 麝香 生乌豆 
1,金银花 连翘 犀角粉 射干 板蓝根 花粉 京赤芍 丹皮 生山栀 焦山栀 干芦根 淡竹叶 
1,小蓟 童便 墨汁 藕汁100毫升 沉香 
1,麝香 丹参 炉甘石 雄黄 火消 黄丹 冰片 
1,远年石灰 大黄 血竭 
1,熟地 龙胆肉 鹿角胶 当归 伏龙肝 黄芪 白术 黑附子 甘草 黄芩 阿胶 
1,党参 黄芪 地黄 续断 当归 白芍 阿胶 艾叶 白术 茯苓 川芎 甘草 
1,干姜炭 党参 白术 半夏 甘草 枳实 三七 桂枝 牡蛎 茯苓 
1,生地 当归 白芍 茯苓 旱莲草 女贞子 仙鹤草 珍珠母 鳖甲 
1,槐花 地榆 仙鹤草 旱莲草 侧柏叶 枳壳 黄芩 胡麻仁 菜苋 
1,当归 芍药 川芎 地黄 白茅根 蒲黄 丹皮 栀子 甘草 
1,栀子 黄芩 侧柏叶 阿胶 生地 白芍 
1,泡参 白术 茯神 杜仲 续断 菟丝子 阿胶 蕲艾 乌贼骨 寄生 
1,犀角 地黄 白芍 甘草 白茅根 藕节 侧柏 牛膝 条芩 
1,条芩 黄连2 槐花 枳壳 升麻 芍药 地黄 苍术 甘草 当归 
1,当归 黄耆 三七 桑叶 
1,当归 川芎 芍药 黄芩 知母 香附 地黄 蒲黄 甘草 侧柏叶 
1,紫藤香 五倍子 牡蛎 白占 三七 半夏 血竭 乳香 象皮 
1,金樱叶 桑叶 嫩苎叶 
1,矿石灰 生韭菜 
1,百部 白及 黄精 玉竹 穿心莲 葎草 
1,白及粉 甘草 蜂蜜 
1,龙骨 寒水石 滑石 枯矾 乳香 没药 轻粉 黄丹 
1,鹿角胶 油头发灰 没药 
1,鹿茸 当归 地黄 冬葵子 蒲黄 
1,龙眼核 
1,制商陆 仙鹤草 地榆 党参 白术 山萸 丹参 黄芪 何首乌 玄参 甘草 
1,黄连 蒲黄 黄芩 当归 地黄 枳壳 槐角 芍药 川芎 甘草 
1,黄连 枳壳 
1,生地 生绵纹 桑叶 丹皮 血见愁 牛膝 三七 苏子 降香 
1,生芍 双花炭 丹参 黄芩 椿皮炭 山楂 陈皮 木香 黄连 
1,牛 羊角及蹄甲 白及 
1,赤小豆 黄耆 黑附子 白蔹 桂心 芍药 黄芩 
1,山药 龙骨 牡蛎 螵蛸 茜草 生杭芍 白头翁 真阿胶 
1,郁金 地黄 粉草 腊月猪板脂 
1,刘寄奴 
1,归尾 生地 赤芍 黄连 枳壳 黄芩 槐角 地榆 荆芥 升麻 花粉 甘草 
1,石膏 淡黄丹 乳香 没药 龙骨 大黄 
1,蒲黄 鹿茸 当归 
1,蒲黄 石榴花 
1,蒲黄 郁金 
1,蒲黄 龙骨 艾叶 
1,鲜荠菜 粳米 
1,茜草 生地 元参 丹皮 防风 阿胶 白芍 黄芩 甘草 
1,黄芪 螵蛸 白芍 白芨 甘松 鹿角胶 元胡 甘草 
1,黄芪 续断 山萸 熟地 枸杞 白术 炒白芍 茜草 三七 甘草 
1,黄芩 
1,桑白皮 黄芩 山栀炭 白茅根 茜草 侧柏叶 紫草 当归 旱莲草 牛膝 
1,天门冬 麦门冬 地黄 丹皮 赤芍 栀子 黄连 山药 茱萸 泽泻 茯苓 
1,黄芩 山栀 丹皮 生地 赤芍 侧柏叶 白茅根 水牛角 牛膝 甘草 
1,血竭 乳香 没药 红花 儿茶 冰片 麝香 朱砂 
1,血竭 麝香 冰片 乳香 没药 红花 朱砂 儿茶 
1,大黄 真秋石 
1,蒲黄 旱莲草 藕节 丹参 丹皮 生地 郁金 荆芥 栀子 川芎 甘草 
1,地黄 阿胶 川芎 桔梗 蒲黄 甘草 
1,南沙参 黄芩 麦冬 茜草 槐花 
1,鲜柿叶 白糖 
1,白木槿花 石膏 白豆腐 白砂糖 
1,生荷叶 艾叶 生柏叶 地黄 
1,生地 熟地 当归 芍药 知母 黄柏 侧柏叶 槐子 连翘 
1,乌鲗骨 芦茹 
1,升麻 清酒 
1,大蓟 小蓟 柏叶 荷叶 白茅根 茜根 大黄 山栀 丹皮 棕榈皮 
1,大蓟 小蓟 白茅根 茜根 老丝瓜 山栀 蒲黄 荷叶 大黄 乱发 
1,马钱子 枳壳 
1,大黄 黄芩 川连 山栀 黑栀 白茅根 桑叶 地榆 茜草 仙鹤草 银花 黄柏 元参 水牛角 甘草 
1,丹参 红花 桃仁 延胡索 乳香 没药 银花 连翘 丹皮 泽泻 生姜 
1,好石灰 清油30毫升 大黄 
1,天门冬 麦门冬 知母 贝母 款冬花 杏仁 当归 地黄 黄连 阿胶珠 蒲黄 京墨 桔梗 薄荷 白蜜 麝香 
1,三七 乳香 陈年石灰 血竭 妇人裙裆末 人参 
1,螵蛸 贝母 陈皮油 
1,乌贼骨 茜草 地榆 继木 蒲黄炭 槐花 荠菜 马齿苋 甘草 
1,乌梅 红糖 
1,雪梨 生地 白茅根 藕取汁 萝卜 麦冬取汁 
1,芎藭 阿胶 甘草 艾叶 当归 芍药 地黄 
1,雪梨汁 藕汁 地黄汁 麦门冬汁 萝卜汁 白茅根 
1,乌梅 五倍子 苦参 射干 炮山甲 牡蛎 火麻仁 
1,桑白皮 地骨皮 花蕊石 三七 血余炭 甘草 
1,地黄 小蓟根 滑石 通草 蒲黄 淡竹叶 藕节 当归 桅子仁 甘草 
1,地黄 小蓟 滑石 木通 蒲黄 藕节 淡竹叶 当归 栀子 甘草 
1,百部 藤苦参 苦冬瓜 箭根薯 羊耳菊根 蔓荆子茎及叶 
1,鲜野苋草全草 白糖 
1,羊胆干膏 百部 白及 贝母 甘草 
1,地榆 砂仁 甘草 甘草 
1,生地 生白芍 黄芩 玄参 石斛 地骨皮 牡蛎 花蕊石 陈棕炭 侧伯叶 藕节炭 
1,当归 炒白芍 香附 青皮 柴胡 川芎 地黄 甘草 
1,黄连 大黄 黄芩 
1,生苎麻根 陈皮炒 粳米 大麦仁 细盐 
1,黄连 黄芩 地黄 赤芍 当归 槐角 槐花 荆芥 地榆 阿胶 
1,黄芩 槐角 生地 芍药 槐花 阿胶 地榆 当归 芥穗 黄连 
1,琥珀屑 降真香末 血竭 
1,竹茹 阿胶 黄酒 
1,珍珠 象皮 冰片 乳香 没药 鸡内金 龙骨 赤石脂 血竭 轻粉 铅粉 辰砂 
1,生地 黄芪 藕节 白芨 山楂 茜草 枣仁 花生衣 
1,珍珠 乳香 螵蛸 琥珀 象皮 没药 龙骨 儿茶 轻粉 血竭 
1,人参 白芍 黄芩 生地 益母草 续断 甘草 
0,西黄 琥珀 辰砂 梅冰 雄精 羚角片 乳香 犀角片 
0,天麻 人参 陈皮 白术 归身 茯神 荆芥 僵蚕 独活 远志 犀角 麦门冬 枣仁 辰砂 半夏 天南星 石膏 甘草 白附子 川芎 郁金 丹参 珍珠 地黄 黄连 金箔 
0,茴香 藿香 丁香 地黄 肉桂 甘草 山药 当归 白术 白芷 干姜 川芎 黄蓍 木香 陈皮 芍药 
0,山楂 天南星 半夏 麦芽 神曲 黄连 连翘 阿魏 栝楼 贝母 皮硝 石碱 萝卜子 黄连 
0,艾叶 香附 茱萸 肉桂 当归 川芎 白芍 地黄 黄芪 续断 
0,艾叶 赤石脂 茯苓 
0,木香 槟榔 使君子肉 白芜荑仁 贯众 苦楝根白皮 虾蟆 夜明砂 
0,当归 川芎 白芍 熟地 生地 白术 砂仁 陈皮 苏梗 杜仲 续断 阿胶 条芩 
0,阿胶 人参 茯苓 川归 生地 川芎 甘草 小茴 人角茴 
0,人参 白术 茯苓 山药 当归 陈皮 半夏 莲肉 甘草 
0,人参 白术 茯神 当归 地黄 枣仁 麦门冬 半夏 枳实 黄连 竹茹 山栀 甘草 辰砂1.5 
0,酒地 圆肉 当归 于术 川芎 菖蒲 茯神 远志 枣仁 黄耆 杭芍 党参 炙草 
0,白豆蔻 苏子 藿香 胆南星 陈皮 
0,桃仁 红花 山楂 归尾 益母草 
0,鸱鸮 穿山甲 桂枝 白芷 木贼草 山萸 郁金 赤苓 赤芍 当归 云苓 红花 白芍 全蝎 麻黄 石斛 
0,防风 细辛 桔梗 茺蔚子 黄芩 大黄 五味子 薄荷 石膏 黄柏 草决明 
0,甘草 陈小麦 麦门冬 茯苓 于葛 灯心 木通 人参 
0,当归 川芎 赤芍 黄柏 栀子 黄连 茵陈 葳蕤仁 苍术 防风 白芷 茯苓 薄荷 泽泻 草决明 甘草 
0,当归 蝉退 僵蚕 天龙 大黄 石 老蜘蛛 
0,陈皮 苎麻根 高良姜 粳米 
0,陈皮 防己 茯苓 槟榔 木通 紫苏 木香 大腹皮 
0,苍术 莲肉 五味子 茯苓 枸杞 地黄 
0,三棱 莪术 宫桂 赤芍 香附 甘草 乌药 
0,滑石 寒水石 甘草 辰砂 
0,蒙花 羌活 菊花 白蒺藜 粉草 草决明 车前子 黄芩 龙胆草 
0,车前子 决明子 黄连 蓝实 黄芩 玄参 沙参 瞿麦 地骨皮 秦艽 蕤仁 
0,赤土 防风 芍药 地骨皮 何首乌 当归 栀子 甘草 
0,茯苓 半夏 陈皮 桔梗 地黄 白术 川芎 人参 芍药 旋覆花 甘草 
0,茯苓 桂心 人参 陈皮 白术 蓬莪术 大黄 茱萸 厚朴 
0,芍药 艾叶 黑附子 干姜 陈皮 当归 川芎 甘草 茱萸 
0,赤石脂 禹余粮 
0,赤石脂 龙骨 艾叶 黑附子 肉豆蔻 缩砂 高良姜 干姜 茱萸 厚朴 
0,豉 竹茹 米 
0,蟾酥 轻扮 枯矾 寒水石 铜绿 乳香 没药 胆矾 麝香 雄黄 蜗牛 朱砂 
0,蟾头 皂荚 青黛 丹参 麝香 巴豆 
0,蝉蜕 菊花 当归 地黄 玄参 赤芍 羌活 连翘 柴胡 木贼 石决明 草决明 白蒺藜 蔓荆子 青葙子 荆芥 防风 薄荷 升麻 黄连 黄芩 栀子 黄柏 枳壳 龙胆草 谷精草 夏枯草 桔梗 
0,蚕茧 白术 信石 
0,葱白 豉 干姜 麻黄 桂 芍药 
0,葱白 阿胶 当归 续断 芎藭 银 
0,当归 甘草 独活 白芷 葱头 
0,椒 当归 姜 菖蒲 黑附子 
0,川芎 香附 龙胆草 决明子 甘草 木贼 菊花 
0,草豆蔻 人参 柴胡 白术 陈皮 甘草 
0,草豆蔻 黑附子 茴香 厚朴 白术 桂心 干姜 陈皮 芎藭 川乌 木香 茱萸 
0,厚朴 青皮 草果 藿香 甘草 丁皮 神曲 良姜 半夏 
0,茺蔚 白蒺藜 羊桃 蒴藋根 漏芦蒿 盐 
0,苍术 片芩 甘草 
0,紫金皮 苍术 猪牙皂角 鸡脚风叶 骨碎补 
0,肉苁蓉 茯苓 五味子 牛膝 五加皮 地骨皮 防风 黄耆 泽泻 桂 磁石 
0,肉苁蓉 黄耆 桂 杜仲 牛膝 茱萸 韭子 
0,远志 菖蒲 牛膝 杏仁 
0,穿山甲 虎胫骨 鸡舌香 麝香 
0,磁石 陈皮 白矾灰 恶实 浆水脚 
0,香附 沉香 缩砂仁 甘草 
0,沉香 石斛 人参 茯苓 菟丝子 山芋 麦门冬 肉苁蓉 五味子 地黄 百合 陈皮 枸杞 黄耆 巴戟天 柏子仁 牛膝 
0,沉香 乌药 麦糵 甘草 
0,沉香 黑附子 川楝 
0,沉香 荆三棱 蓬莪术 白豆蔻 荜澄茄 缩砂仁 草果仁 益智仁 川白姜 丁香 人参 丁皮 木香 茯苓 香附 藿香 半夏 青皮 陈皮 甘草 
0,枳壳 香附 槟榔 延胡索 三棱 蓬术 
0,沉香 丁香 木香 巴豆 杏仁 
0,樗根白皮 无食子 肉豆蔻 茜根 茶末 
0,臭椿白皮 苍术 枳壳 
0,升麻 葛根 甘草 黄芩 半夏 芍药 柴胡 
0,柴胡 鳖甲 茯苓 黄芩 知母 桑白皮 甘草 
0,柴胡 黄芩 陈皮 泽泻 羚羊角 地黄 香豉 栀子 石膏 皮硝 
0,柴胡 知母 芦根 槟榔 陈皮 人参 
0,柴胡 栀子 连翘 地黄 黄连 赤芍 龙胆草 青皮 甘草 
0,生地 白芷 天冬 青蒿 柴胡 玄参 生耆 连翘 百合 知母 
0,柴胡 射干 防葵 丹皮 大黄 杏仁 紫菀 葶苈 紫苏 
0,柴胡 防风 当归 人参 芍药 甘草 黄芩 滑石 大黄 
0,柴胡 升麻 黄芩 黄连 栀子 车前子 决明子 防风 羚羊角 马牙消 甘草 玄参 
0,柴胡 黄芩 石膏 阿胶 麦门 甘草 
0,柴胡 黄芩 干姜 桂枝 甘草 
0,熟地 淮山 柴胡 萸肉 茯苓 丹皮 泽泻 
0,山查 苏木 
0,金银花 薄荷 白芷 防风 芍药 连翘 六一散 大黄 地肤子 食盐 僵蚕 桑枝 蝉蜕 
0,五倍子 绛真香 
0,川乌 雄黄 蝉蜕 川芎 细辛 
0,常山 柴胡 甘草 栀子 茯苓 石膏 蜀漆 鳖甲 
0,常山 羚羊角 乌梅肉 黄芩 甘草 
0,川芎 荆芥 细辛 白芷 甘草 羌活 防风 薄荷 
0,川芎 柴胡 半夏 甘草 甘菊 细辛 人参 前胡 防风 
0,猬皮 雷丸 川楝 黑芝麻 槐角子 男发 乳香 30克 6克 49个 
0,露蜂房 蛇蜕 头发 川山甲 
0,藤黄 雄黄 雌黄 丹参 轻粉 粉霜 麝香 砒霜 黄丹 牡蛎 红藤根 干漆 
0,猪牙皂角 丝瓜子 北细辛 干蟾酥 
0,干胭脂 螵蛸 龙骨 枯矾 冰片 密陀僧 胆矾 青黛 硼砂 黄连 赤石脂 麝香 
0,火消 牙皂 全蝎 雄黄 硼砂 白矾 胆矾 
0,紫荆皮 乳香 甘草 白芷 没药 
0,苍术 枳壳 桔梗 陈皮 芍药 白芷 川芎 当归 交趾桂 半夏 粉草 麻黄 军姜 厚朴 木香 杏仁 茯苓 
0,漏芦 通草 贝母 白芷 
0,梅花蕊 桃花蕊 经霜丝瓜 朱砂 甘草 
0,茱萸 黄连 白芜荑仁 柴胡 
0,鳖甲 甘草 冬瓜汁 车前叶 常山 
0,鳖甲 柴胡 茯苓 子芩 诃黎勒皮 槟榔 芍药 当归 陈皮 知母 大黄 甘草 
0,鳖甲 肉苁蓉 陈皮 青皮 三棱 莪术 神曲 麦芽 茯苓 半夏 秦艽 柴胡 香附 甘草 
0,鳖甲 防葵 人参 前胡 桔梗 枳壳 当归 黑附子 干姜 白术 槟榔 大黄 厚朴 茱萸 甘草 
0,河车 鳖甲 桔梗 芍药 大黄 甘草 苦参 贝母 知母 秋石 豉心 草龙胆 黄药子 莪术 犀角 皮硝 
0,苍术 台乌 白术 黄连 羌活 川乌 草乌 细辛 紫草 防风 独活 藁本 白芷 香附 当归 荆芥 天麻 官桂 甘松 三奈 干姜 麻黄 芍药 牙皂 甘草 麝香 
0,白及 白蔹 白矾 剪草 茱萸 水银豌豆大 麝香 
0,人参 茯苓 柴胡 前胡 羌活 甘草 川芎 独活 桔梗 枳壳 陈皮 
0,贝齿 葵子 石燕 滑石 
0,贝母 桔梗 马兜铃 百合 款冬花 半夏 干姜 防己 麻黄 甘草 杏仁 
0,水银 黑铅 巴豆 黄明胶 百草霜 香墨1寸 腻粉 干蝎 铅白霜 青黛 丹参 
0,破故纸 牛膝 骨碎补 桂心 槟榔 安息香 
0,厚朴 桃仁 杏仁 紫石英 白鲜皮 五加皮 桑白皮 
0,黄耆 当归 川芎 
0,白附子 半夏 
0,当归 川芎 白芍 茯苓 苍术 荆芥 防风 生地 熟地 牛子 红花 甘草 
0,茯苓 防风 桂心 白术 细辛 茱萸 薯蓣 泽泻 黑附子 地黄 紫菀 牛膝 芍药 丹参 黄耆 沙参 苁蓉 干姜 玄参 人参 苦参 独活 
0,淫羊藿 菟丝子 金樱子 狗脊 女贞子 
0,茴香 巴戟天 肉苁蓉 丹皮 枸杞 破故纸 白蒺藜 生地 熟地 辰砂 
0,山萸 当归 五味子 山药 黄耆 川芎 熟地 木瓜 白术 独活 枣仁 
0,桑叶 枸杞 小胡麻 望月砂 何首乌 石决明 菊花 穞豆皮 
0,黄蜡 猪油 乳香 没药 松香 麻油 
0,黑附子 黄耆 牛膝 肉苁蓉 黄蜡 川椒 白蒺藜 
0,晕死鹅 紫河车 升麻 
0,黄耆 潞参 白术 归身 白芍 枣仁 冬虫草 黑附子 上元桂 蔻米 干姜 半夏 陈皮 降香 炙草 
0,天竺黄 沉香 天门冬 芍药 茯神 远志 麦门冬 甘草 旋覆花 苏子 香附 半夏 皂角荚 
0,黄耆 当归 地黄 人参 茯苓 芍药 五味子 牛膝 陈皮 麦门冬 枳壳 甘草 柴胡 
0,黄耆 人参 甘草 红花 芍药 葛根 当归 陈皮 升麻 柴胡 黄柏 黄芩 甘草 
0,薄荷 白蜜 
0,蓖麻子1000颗 矾石 黑豆6颗 
0,破故纸 续断 川乌 防风 萆薢 芍药 地黄 独活 白芷 没药 杜仲 茴香 白术 
0,菝葜 汤瓶内硷 乌梅 
0,荜茇 胡椒 
0,荜澄茄 干姜 陈皮 厚朴 桂 阿魏 肉豆蔻 缩砂 草豆蔻 甘草 黑附子 荜茇 白术 
0,南硼砂 硇砂 乳香 铜绿 螺儿粉 4味入猪胆汁和膏 摊碗内 艾烟熏 就入：轻粉 沙糖 麝香 龙脑 猪胆 
0,白矾 粉霜 朱砂 天南星 蜈蚣 白僵蚕 麝香1字 鹞鸱头 
0,百部 百合 木通 芍药 枳壳 茯苓 柴胡 
0,前胡 柴胡 葶苈 半夏 麻黄 羌活 独活 桔梗 人参 陈皮 白术 枳壳 甘草 茯苓 芎? 石膏 杏仁 
0,黄蜀葵花 黄柏 黄连 栀子 郁金 
0,丁香 陈皮 茴香 三棱 莪术 砂仁 白豆蔻 干姜 生姜 甘草 
0,乳香 没药 黑附子 血竭 川乌 草乌 檀香末 降香末 贝母 麝香 丁香 净蕲艾绵 
0,龙骨 麝 
0,白鲜皮 女萎 防风 细辛 升麻 苍耳 桂 黑附子 五味子 菖蒲 白蒺藜 黄耆 
0,白附子 黑附子 黄狗头骨 
0,白豆蔻 白术 甘草 厚朴 枳壳 桂心 陈皮 高良姜 茯苓 半夏 诃黎勒皮 人参 
0,白蜜 腊月猪肪 麻油 地黄 
0,白薇 紫石英 琥珀 芍药 桂心 续断 防风 茱萸 当归 柏子仁 川乌 丹皮 木香 麝香 
0,鹿茸 白蔹 狗脊 
0,茯苓 芍药 芎藭 桂 大腹皮 枳壳 地黄 
0,丁香 桑叶 人参 藿香 白茅根 
0,白芷 黄连 地榆 
0,白花蛇 露蜂房 苦参 防风 丹参 栀子 薯蓣 秦艽 玄参 白蒺藜 独活 
0,当归 芍药 鹿茸 地黄 
0,螵蛸 白及 轻粉 
0,白矾 盐花 
0,白石英 皮硝 凝水石 茯苓 人参 地骨皮 泽泻 苦参 甘草 麦门冬 
0,乳香 芸香末 铅粉 蓖麻子 
0,零陵香 白芷 青盐 升麻 细辛 麝香 砂锅 石膏 
0,白杨皮 地骨皮 川椒 杏仁 苍耳子 高良姜 地黄 细辛 
0,茯苓 白术 天南星 白附子 白矾 半夏 
0,羊肾 白术 生姜 玄参 泽泻 芍药 茯苓 淡竹叶 地黄 
0,白术 厚朴 桂心 桔梗 干姜 人参 当归 茯苓 甘草 
0,白术 木香 诃黎勒皮 桂心 甘草 丁香 人参 厚朴 陈皮 草豆蔻 
0,白术 草豆蔻 槟榔 甘草 桂心 桔梗 人参 前胡 诃黎勒 茯苓 枳实 
0,白术 当归 芎藭 干姜 陈皮 甘草 
0,白术 五味子 丁香 人参 款冬花 细辛 
0,白术 干姜 人参 厚朴 桂心 细辛 茯苓 当归 茯神 积实 五味子 黑附子 茱萸 远志 旋覆花 泽泻 
0,薄荷 冰片 石膏 滑石 
0,白垩 龙骨 芍药 黄连 当归 茯苓 黄芩 瞿麦 白蔹 石韦 甘草 牡蛎 细辛 黑附子 禹余粮 白石脂 人参 乌贼骨 藁本 甘皮 大黄 
0,白前 桑白皮 地黄 茯苓 地骨皮 麻黄 生姜 
0,白僵蚕 麝香 乌蛇 丹参 干蝎 木香 龙骨 蝉蜕 杜仲 天麻 原蚕蛾 雄黄 
0,猬皮 皂角刺 藤子 猪牙皂角 白矾 
0,槟榔 木香 黄蜀葵花 黄连 
0,槟榔 生姜 紫苏7叶 陈皮 
0,槟榔 羚羊角 木香 郁李仁 茱萸 陈皮 
0,槟榔 桑白皮 紫苏 诃黎勒皮 罗卜子 
0,槟榔 木香 
0,槟榔 防己 芍药 羚羊角 人参 茯苓 薏仁 独活 芎? 桂 黑附子 防风 枣仁 当归 柏子仁 杏仁 地黄 
0,槟榔 丁香 大黄 桂心 陈皮 诃黎勒皮 人参 
0,慈竹1段 黄柏 
0,柏子仁 党参 黄芪 川芎 当归 茯苓 远志 枣仁 肉桂 五味子 半夏 甘草 朱砂 
0,柏子仁 巴戟天 远志 五味子 牛膝 地黄 桂 肉苁蓉 鹿茸 菟丝子 破故纸 干漆 
0,侧柏叶 芍药 艾 地黄 禹余粮 麒麟竭 当归 牛角 
0,斑蝥 黄蜡 猪脂 
0,川芎 菊花 蔓荆子 蝉蜕 蛇蜕 蒙花 薄荷 木贼草 荆芥 黄连 楮桃仁 地骨皮 花粉 炙草 川椒 当归 白蒺藜 
0,蔓荆子 木贼草 蒙花 川芎 白蒺藜 当归 甘菊 薄荷 黄连 蝉蜕 楮实 花粉 地骨皮 川椒 甘草 
0,乳香 蟾酥 白信 没药 丁香 血竭 麝香 斑蝥 胆矾 雄黄 灵磁石 蓖麻仁 
0,槟榔 红娘子 狗脊 丹参 赤石脂 黄连 轻粉 
0,琥珀 辰砂 雄黄 胆南星 僵蚕 全蝎 丹参 麝香 天竺黄 茯苓 
0,黄连 黄芩 大黄 栀子 青黛 细辛 干姜 
0,巴豆 丹参1字 干姜1字 麝香1字 
0,巴戟天 茴香 胡桃仁 
0,当归 黄连 白芍 白术 山楂 石莲子 苍术 枳壳 麦芽 神曲 肉豆蔻 木香 
0,大黄 巴霜 葛根 
0,半夏 茯苓块 川连 厚朴 通草 
0,半夏 茯苓 地黄 陈皮 细辛 人参 芍药 旋覆花 芎藭 桔梗 甘草 生姜 
0,半夏 白术 茯苓 人参 桂 甘草 黑附子 
0,半夏 茯苓 
0,半夏 麦门冬 茱萸 当归 阿胶 干姜 枣仁 
0,半夏 前胡 射干 白术 桂心 人参 枳壳 
0,半夏 知母 桔梗 黄耆 柴胡 鳖甲 人参 茯苓 秦艽 麦门冬 芍药 甘草 乌梅肉 大腹皮 
0,半夏 厚朴 茯苓 生姜 干苏叶 
0,半夏 甘草 远志 干姜 桂心 细辛 椒 黑附子 
0,冰片 人中白 黄柏 蒲黄 薄荷 黄连 甘草 青黛 硼砂 朴消 枯矾 
0,冰片 硼砂 
0,藿香 白芷 前胡 黄耆 甘草 人参 羌活 防风 
0,白术 茯苓 山药 莲肉 芡实 陈皮 甘草 腊米 
0,八物汤加阿胶 艾叶 
0,天龙 全蝎 甲片 儿茶 蝉蜕 雄精 冰片 麝香 
0,藿香 破故纸 大腹皮 槟榔 雄黄 轻粉 丹参 枯白矾 
0,黄芩 黄连 黄柏 蒲黄 雄黄 蛇蜕 鸡内金 丁香 
0,茱萸 山药 丹皮 云苓 泽泻 熟地 五味子 炙黄耆 
0,五加皮 白术 何首乌 生地 当归 虎胫骨 续断 杜仲 
0,地黄 五味子 天门冬 菖蒲 远志 石韦 茯苓 桂心 
0,辰砂 椒 
0,山药 杜仲 续断 
0,金箔 腻粉 
0,蛇蜕皮 丹参 
0,杏仁 萝卜子 麦糵 神曲 
0,羌活 麻黄 生地 黄柏 升麻 甘草 黄连 归身 防风 川芎 黄芩 藁本 柴胡 干葛 苍术 红花 细辛 苏木 陈皮 白术 吴萸 连翘 
