1,阿胶 糯米 红糖 
0,山楂 苍术 白术 半夏 黄芩 茯苓 陈皮 萝卜子 黄连 神曲 茱萸 连翘 
0,粉草 升麻 当归 川芎 黄耆 芍药 山栀 乳香 黄芩 羌活 桔梗 花粉 青皮 白芷 
0,丁香 木香 槟榔 川楝 锡灰 干漆 巴霜 
0,大石蟹 黄连 黄柏 黄芩 大黄 细辛 桔梗 防风 荆芥 栀子 薄荷 羌活 乌药 陈皮 枳壳 前胡 当归 姜黄 木贼 菊花 干姜 桑白皮 
0,白芷 川芎 
0,生地 薄荷 独活 赤芍 川芎 川羌 连翘 香附 荆芥 当归 防风 桃仁 米仁 青皮 加皮 丹皮 杜仲 川柏 玄胡 白芍 白芷 牛膝 红花 白鲜皮 木通 苏木 木瓜 甘草 厚朴 苏梗 枳实 枳壳 秦艽 川断 黄耆 甘松 三棱 山奈 玄参 刘寄奴 骨碎补 铅粉 
0,人参 白术 干姜 甘草 肉豆蔻 
0,肉豆蔻 缩砂 诃黎勒 铅丹 胡粉 龙骨 白矾 天仙子 
0,羌活 黑豆 
0,川芎 苏木 丹皮 蒲黄 乳香 没药 草乌 血竭 乌药 菖蒲 黄芩 益母草 生地 败龟板 熟地 夏枯草 枸杞 当归 阿胶 苦参 苁蓉 知母 地骨皮 人参 琐阳 牛膝 柴胡 藁本 升麻 桃仁 芍药 柴胡 红花 
0,生地 赤芍 香附 青皮 郁金 元胡 没药 海藻 夏枯草 薄荷 菊花 
0,当归 地黄 地黄 枸杞 白芍 人参 五味子 麦门冬 地骨皮 白术 茯苓 莲肉 山药 贝母 甘草 琥珀 薏仁 
0,白术 茯苓 甘草 藿香 草果子 丁香 
0,竹沥 甘草 秦艽 葛根 黄芩 麻黄 防已 细辛 桂心 干姜 防风 升麻 茯苓 黑附子 杏仁 
0,生玳瑁 生犀以冷水浓磨汁200毫升 
0,牛膝许 臭花娘根 许 
0,独活 丹参 细辛 五加皮 牛膝 川芎 白僵蚕 桑白皮 麻黄 甘草 杏仁 
0,独活 枳壳 芎? 防风 当归 细辛 桂心 赤箭 羚羊角 
0,独活 黄耆 桂 巴戟天 木香 人参 枳壳 泽泻 茯苓 龙齿 天雄 白蒺藜 芍药 
0,石胆 黄连 黄柏 蕤仁 铜青 皮硝 
0,鹅不食草 辛夷花 
0,枳实 茯苓 人参 槟榔 白术 黑牵牛 
0,杜仲 远志 地黄 桂心 茯苓 枳壳 牛膝 菟丝子 羌活 
0,花蕊石 丹参 黄丹 牡蛎 蚌粉 自然铜 草乌 骨碎补 防己 龙骨 乌药 虎骨 乳香 没药 血竭 白胶香 安息香 
0,当归 黄耆 地黄 川芎 地骨皮 芍药 
0,当归 钩藤 秦艽 丹皮 防风 青皮 黄芩 柴胡 甘草 
0,当归 人参 厚朴 葱白1虎口 胶 芎? 
0,当归 红花 丹参 月季花 米酒 
0,当归 川芎 芍药 红花 紫草 地黄 
0,当归 芍药 独活 防风 茯苓 黄芩 秦艽 杏仁 甘草 桂心 
0,当归 芍药 茯苓 甘草 栀子 
0,京楂核 当归 川芎 川木通 茴香 川楝 杭青皮 猪苓 宣泽泻 木香 黑栀仁 
0,当归 丹皮 芍药 延胡索 芎? 桂 黄芩 地黄 甘草 水蛭 紫葳 
0,当归 京三棱 鳖甲 槟榔 茯苓 芍药 桑白皮 大黄 郁李仁 牵牛子 桂心 枳壳 
0,当归 芍药 香附 
0,当归 麻黄 桂心 芎? 海桐皮 干姜 杏仁 独活 甘草 
0,当归 地黄 
0,黄连 黄芩 黄柏 黄耆 地黄 当归 栀子 浮小麦 
0,当归 芎? 芍药 苦楝子 硇砂 蒲黄 
0,山栀仁 五灵脂 草豆仁 蒲黄 
0,半夏 天南星 枳实 陈皮 茯苓 
0,茯苓 滑石 知母 泽泻 黄柏 
0,半夏 天南星 干姜 
0,茯苓 人参 白附子 枣仁 麝香 辰砂 
0,人参 白术 阿胶 干姜 黑附子 枣仁 粳米1撮 
0,人参 白术 茯苓 枳实 石莲肉 陈皮 韭子 半夏 远志 枣仁 牡蛎 甘草 
0,肉桂 陈皮 红花 干漆 当归 泽兰 荆芥 川芎 生地 蒲黄 赤芍 
0,丁香 蝎梢 半夏 
0,白矾 滑石 
0,蟾酥 轻粉 白矾 寒水石 铜绿 乳香 没药 麝香 朱砂 蜗牛 
0,豉 甘草 桂心 大黄 皮硝 
0,大黄 芫花 蓬莪术 咸消 桃仁 朱粉 
0,大黄 麦门冬 栀子 黄芩 皮硝 甘草 
0,大黄 桔梗 黄芩 玄参 羚羊角 人参 茯苓 
0,大黄 木通 葶苈 
0,大黄 郁金 黄药 腻粉 猪牙皂荚 
0,大黄 诃黎勒 
0,大黄 柴胡 茯苓 人参 木香 桂心 枳壳 槟榔 桃仁 
0,大胡麻 苦参 白蒺藜 生地 薏仁 防风 荆芥 当归 威灵仙 苍术 羌活 独活 海风藤 全蝎 乌梢蛇 丹皮 蕲蛇 秦艽 干浮萍 角针 知母 苍耳草 僵蚕 地肤子 白鲜皮 白附子 蝉衣 豨莶草 黄连 夏枯草 川芎 蛇床子 黑芝麻 甘菊 何首乌 杏仁 枫子仁 
0,沉香 鳖甲 柴胡 人参 桔梗 茯苓 川芎 藿香 羌活 木香 陈皮 丹皮 安息香 当归 厚朴 京三棱 官桂 黑附子 牛膝 桃仁 和皮大腹子 
0,大青 石膏 香豉 葛根 栀子 地黄 川皮硝 甘草 
0,大青 甘草 阿胶 豉 白术 陈皮 
0,地黄 丹参 杏仁 川椒 泽泻 黄耆 茯苓 大豆 薯蓣 茯神 前胡 铁精 柏子仁 羌活 桂心 秦艽 芎藭 人参 麦门冬 远志 丹砂 阿胶 甘草 大黄 银屑 螵蛸 枣仁 白蔹 当归 干姜 紫石英 防风 
0,甘遂 地黄 槟榔 麦糵 铅白霜 
0,桑白皮 大豆1斗 
0,人参 黄耆 生地 甘草 当归 川芎 白芍 桂心 木香 青皮 
0,蜈蚣 鱼鳔 左蟠龙 
0,菟丝子 苁蓉 黑附子 五味子 鹿茸 鸡腿胫 螵蛸 
0,大腹皮 枳壳 芍药 秦艽 羌活 天门冬 地黄 甘草 郁李仁 
0,大腹皮 桔梗 枳壳 白术 当归 大黄 桂心 木香 芎? 
0,麻黄 人参 黄芩 芍药 芎? 甘草 杏仁 防风 桂心 黑附子 
0,白芷 白术 前胡 茱萸 芎? 川椒 细辛 当归 桂心 苦酒 
0,白僵蚕 蝉蜕 全蝎 当归 生地 金银花 泽兰 泽泻 木通 车前子 黄连 黄芩 栀仁 五味子 麦冬 龙胆草 丹皮 知母 甘草 
0,柴胡 秦艽 常山 贝母 甘草 乌梅 山栀 豉心 鳖甲 黄芩 生姜 大黄 桃枝 柳枝 葱白 薤白 糯米 
0,蝉蜕 白蒺藜 羌活 荆芥 黄耆 乌蛇皮 
0,天麻 羚羊角 羌活 防风 芎? 菊花 茱萸 薯蓣 细辛 藁本 独活 秦艽 麻黄 枳壳 白蒺藜 蔓荆子 黄耆 鹿角胶 枣仁 丹参 莽草 地骨皮 白鲜皮 防己 桂心 黑附子 牛膝 薏仁 杜仲 石南 当归 地黄 萆薢 侧子 苍耳苗 干姜 阿胶 犀角屑 人参 白术 川椒 白芷 茵芋 甘草 杏仁 
0,荜茇 肉桂 干姜 良姜 
0,川乌 当归 赤芍 苏木 没药 乳香 穿山甲 独活 
0,肉豆蔻 丁香 厚朴 白术 半夏 陈皮 丹参 黑附子 干姜 桂 
